{
  "schema": "com.asharia.engine-distribution",
  "schemaVersion": 1,
  "engineGenerationId": "sha256-6cde7eeb2af326e09c2183700fbb4ef36ef5fc6ab7ab3361e1a19564e013b409",
  "distribution": {
    "id": "com.asharia.distribution.engine-0-1",
    "engineVersion": "0.1.0",
    "engineApiVersion": "0.1.0"
  },
  "context": {
    "targetPlatform": "com.asharia.platform.windows",
    "configuration": "Debug",
    "toolchain": {
      "compilerId": "MSVC",
      "compilerVersion": "19.40",
      "targetSystem": "Windows",
      "targetArchitecture": "x86_64",
      "runtimeLibrary": "MultiThreadedDebugDLL"
    }
  },
  "editorImage": {
    "entryPoint": "bin/asharia-editor.exe",
    "files": [
      {
        "path": "bin/asharia-editor.exe",
        "role": "executable",
        "mediaType": "application/vnd.microsoft.portable-executable",
        "size": 4096,
        "integrity": {
          "algorithm": "sha256",
          "digest": "1111111111111111111111111111111111111111111111111111111111111111"
        }
      },
      {
        "path": "resources/editor-shell.json",
        "role": "resource",
        "mediaType": "application/json",
        "size": 128,
        "integrity": {
          "algorithm": "sha256",
          "digest": "2222222222222222222222222222222222222222222222222222222222222222"
        }
      }
    ]
  },
  "bundledPackages": [
    {
      "id": "com.asharia.features.standard3d",
      "version": "0.1.0",
      "packageKind": "feature-set",
      "availability": "default",
      "root": "packages/features/standard3d",
      "manifestIntegrity": {
        "algorithm": "sha256",
        "digest": "3333333333333333333333333333333333333333333333333333333333333333"
      },
      "payloadIntegrity": {
        "algorithm": "sha256",
        "digest": "4444444444444444444444444444444444444444444444444444444444444444"
      }
    },
    {
      "id": "com.asharia.system.rendering-vulkan",
      "version": "0.1.0",
      "packageKind": "installable-capability",
      "availability": "required",
      "root": "packages/systems/rendering-vulkan",
      "manifestIntegrity": {
        "algorithm": "sha256",
        "digest": "5555555555555555555555555555555555555555555555555555555555555555"
      },
      "payloadIntegrity": {
        "algorithm": "sha256",
        "digest": "6666666666666666666666666666666666666666666666666666666666666666"
      }
    }
  ],
  "packageArtifacts": [
    {
      "artifactGenerationId": "sha256-aaaaaaaaaaaaaaaaaaaaaaaaaaaaaaaaaaaaaaaaaaaaaaaaaaaaaaaaaaaaaaaa",
      "package": {
        "id": "com.asharia.system.rendering-vulkan",
        "version": "0.1.0"
      },
      "context": {
        "hostKind": "editor",
        "targetPlatform": "com.asharia.platform.windows",
        "configuration": "Debug"
      },
      "manifestPath": "artifacts/sha256-aaaaaaaaaaaaaaaaaaaaaaaaaaaaaaaaaaaaaaaaaaaaaaaaaaaaaaaaaaaaaaaa/packages/com.asharia.system.rendering-vulkan/asharia.package.artifacts.json",
      "manifestIntegrity": {
        "algorithm": "sha256",
        "digest": "7777777777777777777777777777777777777777777777777777777777777777"
      }
    }
  ],
  "hostProfiles": [
    {
      "hostKind": "editor",
      "targetPlatform": "com.asharia.platform.windows",
      "path": "profiles/editor/asharia.host-profile.json",
      "integrity": {
        "algorithm": "sha256",
        "digest": "8888888888888888888888888888888888888888888888888888888888888888"
      }
    },
    {
      "hostKind": "runtime",
      "targetPlatform": "com.asharia.platform.windows",
      "path": "profiles/runtime/asharia.host-profile.json",
      "integrity": {
        "algorithm": "sha256",
        "digest": "9999999999999999999999999999999999999999999999999999999999999999"
      }
    }
  ]
}
